{"attributes":{"title":"CV","menu":"CV","date":"30-10-2019","description":"John Doe's Resumé","basics":{"name":"John Doe","label":"Researcher","email":"john@doe.tld","phone":"123-456-7890","url":"http://johndoe.tld","description":"A summary of John Doe ...","location":{"address":"2630 Hegal Place","postal_code":23242,"city":"Alexandria","region":"Virginia"},"profiles":[{"network":"Twitter","username":"john","url":"http://twitter.com/john"}]},"competencies":[{"title":"Researching","name":"High","keywords":["Biology","Chemistry","Desk-cleaning"]}],"work":[{"title":"Researcher","name":"Mars University","url":"http://mars.edu","start_date":"2015-01-01","description":"Manufactured class A and B drugs."},{"title":"Research Assistant","name":"Mars University","url":"http://mars.edu","start_date":"2013-01-01","end_date":"2014-01-01","description":"Cleaned desks and sample-tubes extensively."}],"volunteer":[{"title":"Window-washer","name":"Window-washers United","url":"http://ww.u/","start_date":"2012-01-01","end_date":"2013-01-01"}],"education":[{"title":"Bachelor of Biology","name":"Mars University","start_date":"2011-01-01","end_date":"2013-01-01"}],"awards":[{"title":"Honours Degree","date":"2013-11-01","name":"Mars University"}],"publications":[{"title":"Sartreist existentialism, objectivism and surrealism","name":"Mars University","date":"2013-10-01","url":"http://www.elsewhere.org/journal/pomo/709295355/"}],"interests":[{"title":"Wildlife","keywords":["Ferrets","Unicorns","Microwaves"]}],"languages":[{"title":"English","level":"Native speaker"}]},"body":"","bodyBegin":71,"frontmatter":"title: CV\r\nmenu: CV\r\ndate: 30-10-2019\r\ndescription: \"John Doe's Resumé\"\r\nbasics:\r\n  name: \"John Doe\"\r\n  label: Researcher\r\n  email: \"john@doe.tld\"\r\n  phone: \"123-456-7890\"\r\n  url: \"http://johndoe.tld\"\r\n  description: \"A summary of John Doe ...\"\r\n  location:\r\n    address: 2630 Hegal Place\r\n    postal_code: 23242\r\n    city: Alexandria\r\n    region: Virginia\r\n  profiles:\r\n    - network: Twitter\r\n      username: john\r\n      url: \"http://twitter.com/john\"\r\ncompetencies:\r\n  - title: \"Researching\"\r\n    name: High\r\n    keywords:\r\n      - Biology\r\n      - Chemistry\r\n      - Desk-cleaning\r\nwork:\r\n  - title: Researcher\r\n    name: Mars University\r\n    url: \"http://mars.edu\"\r\n    start_date: \"2015-01-01\"\r\n    description: \"Manufactured class A and B drugs.\"\r\n  - title: Research Assistant\r\n    name: Mars University\r\n    url: \"http://mars.edu\"\r\n    start_date: \"2013-01-01\"\r\n    end_date: \"2014-01-01\"\r\n    description: \"Cleaned desks and sample-tubes extensively.\"\r\nvolunteer:\r\n  - title: Window-washer\r\n    name: Window-washers United\r\n    url: \"http://ww.u/\"\r\n    start_date: \"2012-01-01\"\r\n    end_date: \"2013-01-01\"\r\neducation:\r\n  - title: \"Bachelor of Biology\"\r\n    name: Mars University\r\n    start_date: \"2011-01-01\"\r\n    end_date: \"2013-01-01\"\r\nawards:\r\n  - title: Honours Degree\r\n    date: \"2013-11-01\"\r\n    name: Mars University\r\npublications:\r\n  - title: Sartreist existentialism, objectivism and surrealism\r\n    name: Mars University\r\n    date: \"2013-10-01\"\r\n    url: \"http://www.elsewhere.org/journal/pomo/709295355/\"\r\ninterests:\r\n  - title: Wildlife\r\n    keywords:\r\n      - Ferrets\r\n      - Unicorns\r\n      - Microwaves\r\nlanguages:\r\n  - title: English\r\n    level: \"Native speaker\""}